query,category,subcategory
My face is breaking out with red bumps,acne,inflammatory_acne
I have blackheads on my nose,acne,comedonal_acne
What can I use for pimples on my forehead,acne,treatment
How do I get rid of acne scars,acne,post_acne
My skin is very oily by midday,oily_skin,general
Best products for oily acne-prone skin,oily_skin,product_recommendation
My T-zone is so shiny,oily_skin,general
How to control oil production,oily_skin,treatment
My face feels tight and flaky,dry_skin,general
I have dry patches around my mouth,dry_skin,general
Best moisturizer for very dry skin,dry_skin,product_recommendation
My skin is peeling after using retinol,dry_skin,irritation
What causes dry skin in winter,dry_skin,causes
I have an oily T-zone but dry cheeks,combination_skin,general
How to care for combination skin,combination_skin,routine
Products for combination skin type,combination_skin,product_recommendation
My skin gets red easily,sensitive_skin,general
I react to most skincare products,sensitive_skin,allergic_reaction
Burning sensation after applying cream,sensitive_skin,irritation
Best gentle cleanser for sensitive skin,sensitive_skin,product_recommendation
Fragrance-free products for reactive skin,sensitive_skin,product_recommendation
My skin stings when I use products,sensitive_skin,irritation
I have itchy red patches on my arms,eczema,symptoms
Eczema flare-up on hands,eczema,flare_up
Best cream for atopic dermatitis,eczema,treatment
My eczema gets worse in winter,eczema,triggers
How to prevent eczema flare-ups,eczema,prevention
I have thick scaly patches on my elbows,psoriasis,symptoms
Red patches covered with silvery scales,psoriasis,symptoms
Psoriasis treatment options,psoriasis,treatment
My psoriasis is getting worse,psoriasis,flare_up
Brown spots on my face,hyperpigmentation,melasma
Dark spots after acne,hyperpigmentation,post_inflammatory
Sun damage and age spots,hyperpigmentation,sun_damage
How to fade dark spots,hyperpigmentation,treatment
Uneven skin tone on face,hyperpigmentation,general
Best products for pigmentation,hyperpigmentation,product_recommendation
Vitamin C for dark spots,hyperpigmentation,ingredients
My skin is starting to wrinkle,aging,wrinkles
Fine lines around my eyes,aging,wrinkles
Sagging skin on jawline,aging,sagging
How to prevent premature aging,aging,prevention
Best anti-aging ingredients,aging,ingredients
Retinol for wrinkles,aging,treatment
My skin looks dull and tired,aging,dullness
Loss of firmness in skin,aging,sagging
I got sunburned at the beach,sun_damage,sunburn
Dark spots from sun exposure,sun_damage,hyperpigmentation
How to protect skin from sun,sun_damage,prevention
Best sunscreen for daily use,sun_damage,product_recommendation
SPF 30 or SPF 50,sun_damage,product_recommendation
Sunscreen for acne-prone skin,sun_damage,product_recommendation
My skin burns easily in the sun,sun_damage,general
I have enlarged pores on my nose,pores,enlarged_pores
How to minimize pore appearance,pores,treatment
Clogged pores on chin,pores,clogged_pores
Best products to shrink pores,pores,product_recommendation
What is rosacea,rosacea,general
My cheeks are always red and flushed,rosacea,symptoms
Burning sensation on face,rosacea,symptoms
Bumps and pimples with redness,rosacea,papulopustular
Rosacea triggers and causes,rosacea,triggers
Treatment for redness on face,rosacea,treatment
Small red veins on my cheeks,rosacea,telangiectasia
What causes under eye bags,eye_concerns,bags
Dark circles under my eyes,eye_concerns,dark_circles
Puffiness around eyes in morning,eye_concerns,puffiness
Best eye cream for wrinkles,eye_concerns,product_recommendation
Crow's feet treatment,eye_concerns,wrinkles
My lips are always chapped,lip_care,chapped_lips
Best lip balm for dry lips,lip_care,product_recommendation
Dark lips how to lighten,lip_care,hyperpigmentation
What is hyaluronic acid,ingredients,humectant
Benefits of niacinamide,ingredients,general
Can I use vitamin C with retinol,ingredients,combination
What does salicylic acid do,ingredients,exfoliant
Difference between AHA and BHA,ingredients,exfoliant
Is retinol safe during pregnancy,ingredients,safety
What is ceramides good for,ingredients,barrier_repair
Benefits of glycolic acid,ingredients,exfoliant
Should I use toner,routine,steps
Morning skincare routine order,routine,morning
Night skincare routine steps,routine,evening
How often to exfoliate,routine,frequency
When to apply serums,routine,steps
Cleanser before or after makeup,routine,order
Double cleansing method,routine,cleansing
How to layer skincare products,routine,application
Can I skip moisturizer if I have oily skin,routine,oily_skin
Do I need sunscreen indoors,routine,sunscreen
Best cleanser for acne,product_recommendation,acne
Moisturizer for dry sensitive skin,product_recommendation,dry_skin
Affordable retinol products,product_recommendation,anti_aging
Korean skincare for beginners,product_recommendation,general
Natural products for eczema,product_recommendation,eczema
Drugstore vs high-end skincare,product_recommendation,general
Cruelty-free skincare brands,product_recommendation,general
Non-comedogenic moisturizer,product_recommendation,acne
Pregnancy-safe skincare products,product_recommendation,safety
My skin purged after starting new product,side_effects,purging
Red rash after using new cream,side_effects,allergic_reaction
Skin peeling from exfoliation,side_effects,over_exfoliation
Breakout from new moisturizer,side_effects,breakout
How long does skin purging last,side_effects,purging
Irritation from retinol,side_effects,retinol_irritation
What foods cause acne,lifestyle,diet
Does drinking water improve skin,lifestyle,hydration
Exercise and skin health,lifestyle,exercise
Stress causing breakouts,lifestyle,stress
Sleep and skin connection,lifestyle,sleep
Smoking effects on skin,lifestyle,smoking
How does pollution affect skin,environmental,pollution
Skin care in humid climate,environmental,humidity
Winter skin care tips,environmental,weather
Hard water and skin problems,environmental,water_quality
I have a mole that changed color,medical_concern,moles
Sudden rash all over body,medical_concern,rash
Painful cyst on face,medical_concern,cysts
Skin infection symptoms,medical_concern,infection
When to see a dermatologist,medical_concern,general
Suspicious spot on skin,medical_concern,skin_cancer
Severe itching all over,medical_concern,general
Warts on hands,medical_concern,warts
Fungal infection on skin,medical_concern,fungal
Cold sore on lip,medical_concern,viral
Teenage acne solutions,age_specific,teen
Skincare for women over 50,age_specific,mature
Baby eczema treatment,age_specific,baby
Toddler dry skin,age_specific,toddler
Men's skincare routine,age_specific,men
Preteen skincare basics,age_specific,preteen
Hormonal acne in 30s,hormonal,acne
Skin changes during menopause,hormonal,menopause
Pregnancy skin changes,hormonal,pregnancy
Period breakouts,hormonal,menstrual
How to fade acne scars naturally,home_remedies,acne_scars
Aloe vera for sunburn,home_remedies,sunburn
Honey mask for acne,home_remedies,acne
Oatmeal for eczema,home_remedies,eczema
Green tea for skin,home_remedies,antioxidants
Coconut oil for dry skin,home_remedies,moisturizing
DIY face mask recipes,home_remedies,masks
Can makeup cause acne,makeup,acne
Best foundation for dry skin,makeup,dry_skin
How to remove makeup properly,makeup,removal
Makeup for sensitive skin,makeup,sensitive_skin
Primer for large pores,makeup,pores
Setting spray for oily skin,makeup,oily_skin
Difference between dermatologist and esthetician,professional_care,general
What is a chemical peel,professional_care,treatments
Microneedling benefits,professional_care,treatments
Laser treatment for acne scars,professional_care,treatments
Professional facial frequency,professional_care,facials
Botox vs fillers,professional_care,injectables
What is dermaplaning,professional_care,treatments
Extraction facial for blackheads,professional_care,facials
Body acne on back,body_skin,bacne
Keratosis pilaris on arms,body_skin,kp
Dry skin on legs,body_skin,dry_skin
Dark underarms treatment,body_skin,hyperpigmentation
Rough elbows and knees,body_skin,rough_texture
Stretch marks removal,body_skin,stretch_marks
Ingrown hairs after shaving,body_skin,ingrown_hairs
Body lotion for very dry skin,body_skin,product_recommendation
Cellulite reduction,body_skin,cellulite
Excessive sweating,body_skin,hyperhidrosis
How much to spend on skincare,budget,general
Affordable skincare routine,budget,routine
Are expensive products worth it,budget,value
Budget-friendly acne treatment,budget,acne
Cheap vs expensive moisturizer,budget,comparison
Best drugstore serums,budget,serums
My skin is getting worse,troubleshooting,worsening
Products not working anymore,troubleshooting,product_efficacy
Sudden skin changes,troubleshooting,changes
Why is my routine not working,troubleshooting,routine
Breakout from switching products,troubleshooting,breakout
Skin became sensitive suddenly,troubleshooting,sensitivity
Texture of my skin changed,texture,rough_texture
Bumpy forehead,texture,rough_texture
Smooth skin tips,texture,general
Orange peel texture on face,texture,large_pores
Skin feels rough,texture,rough_texture
How to get glowing skin,general,radiance
Dewy skin look,general,radiance
Matte skin appearance,general,matte
Glass skin routine,general,radiance
Skin barrier repair,general,barrier
How to know my skin type,general,skin_type
Skin cycling method,general,routine
Minimalist skincare routine,general,routine
Cystic acne on chin,acne,inflammatory_acne
Whiteheads all over my face,acne,comedonal_acne
Hormonal acne on jawline,acne,hormonal_acne
Back acne treatment,acne,body_acne
Chest acne won't go away,acne,body_acne
Acne on shoulders,acne,body_acne
Fungal acne treatment,acne,fungal_acne
How to pop a pimple safely,acne,treatment
Acne spot treatment overnight,acne,treatment
Does toothpaste help acne,acne,treatment
Ice for acne inflammation,acne,treatment
Benzoyl peroxide for acne,acne,ingredients
Salicylic acid vs benzoyl peroxide,acne,ingredients
Tea tree oil for pimples,acne,treatment
Acne from dirty pillowcase,acne,causes
Phone causing acne on cheek,acne,causes
Hair products causing forehead acne,acne,causes
Maskne prevention,acne,prevention
Face mask causing breakouts,acne,causes
Acne from wearing hats,acne,causes
Blotting papers for oily skin,oily_skin,treatment
Mattifying primer recommendations,oily_skin,product_recommendation
Oil-free moisturizer,oily_skin,product_recommendation
My makeup slides off oily skin,oily_skin,makeup
Pores look huge on oily skin,oily_skin,pores
Clay mask for oil control,oily_skin,treatment
Niacinamide for oily skin,oily_skin,ingredients
Overwashing making skin oilier,oily_skin,causes
Dehydrated oily skin,oily_skin,general
Sebaceous filaments vs blackheads,oily_skin,general
Extremely dry skin on face,dry_skin,general
Skin so dry it cracks,dry_skin,severe
Best oils for dry skin,dry_skin,product_recommendation
Hyaluronic acid not working,dry_skin,treatment
Slugging method for dryness,dry_skin,treatment
Dry skin around nose,dry_skin,general
Flaky makeup on dry skin,dry_skin,makeup
Aquaphor for dry skin,dry_skin,product_recommendation
CeraVe vs Cetaphil for dry skin,dry_skin,product_recommendation
Face oil recommendations,dry_skin,product_recommendation
Dry skin after showering,dry_skin,general
Indoor heating drying my skin,dry_skin,environmental
Nose gets oily but cheeks dry,combination_skin,general
Different products for different zones,combination_skin,routine
Moisturizer for combo skin,combination_skin,product_recommendation
Toner for combination skin,combination_skin,product_recommendation
Managing combination skin in summer,combination_skin,seasonal
Everything makes my face red,sensitive_skin,general
Rosacea vs sensitive skin,sensitive_skin,general
Best ingredients for sensitive skin,sensitive_skin,ingredients
Hypoallergenic skincare,sensitive_skin,product_recommendation
Patch testing new products,sensitive_skin,safety
La Roche Posay for sensitive skin,sensitive_skin,product_recommendation
Mineral sunscreen for sensitive skin,sensitive_skin,product_recommendation
Stinging from vitamin C,sensitive_skin,irritation
Centella asiatica for sensitivity,sensitive_skin,ingredients
How to repair sensitive skin barrier,sensitive_skin,treatment
Weeping eczema,eczema,severe
Eczema behind ears,eczema,location
Dyshidrotic eczema on hands,eczema,types
Baby eczema on face,eczema,age_specific
Eczema from stress,eczema,triggers
Steroid cream for eczema,eczema,treatment
Natural eczema remedies,eczema,treatment
Eczema diet changes,eczema,lifestyle
Bleach bath for eczema,eczema,treatment
Eczema vs psoriasis difference,eczema,general
Scalp psoriasis treatment,psoriasis,location
Nail psoriasis symptoms,psoriasis,symptoms
Guttate psoriasis,psoriasis,types
Plaque psoriasis on knees,psoriasis,symptoms
Psoriasis biologics,psoriasis,treatment
Coal tar for psoriasis,psoriasis,treatment
Psoriasis flare triggers,psoriasis,triggers
Psoriatic arthritis symptoms,psoriasis,related_conditions
PIH vs PIE,hyperpigmentation,types
Tranexamic acid for pigmentation,hyperpigmentation,ingredients
Kojic acid for dark spots,hyperpigmentation,ingredients
Hydroquinone safety,hyperpigmentation,ingredients
Alpha arbutin for brightening,hyperpigmentation,ingredients
Dark spots on legs,hyperpigmentation,body
Melasma on upper lip,hyperpigmentation,melasma
Pregnancy mask melasma,hyperpigmentation,melasma
Dark spots from bug bites,hyperpigmentation,post_inflammatory
Laser for pigmentation removal,hyperpigmentation,treatment
Chemical peel for dark spots,hyperpigmentation,treatment
Sun spots on hands,hyperpigmentation,sun_damage
Freckles vs sun damage,hyperpigmentation,general
Dark knuckles treatment,hyperpigmentation,body
Dark elbows,hyperpigmentation,body
Nasolabial folds deepening,aging,wrinkles
Marionette lines treatment,aging,wrinkles
Forehead lines,aging,wrinkles
11 lines between eyebrows,aging,wrinkles
Neck wrinkles and lines,aging,neck
Crepey skin on neck,aging,neck
Hand wrinkles aging,aging,hands
Chest wrinkles from sleeping,aging,prevention
Retinol vs retinoids,aging,ingredients
Tretinoin for anti-aging,aging,ingredients
Peptides for wrinkles,aging,ingredients
Bakuchiol alternative to retinol,aging,ingredients
Collagen supplements for skin,aging,supplements
Micro-needling for fine lines,aging,treatment
Face yoga for wrinkles,aging,prevention
Jowls treatment non-surgical,aging,sagging
Under eye hollows,aging,volume_loss
Thin skin with age,aging,general
Sunscreen reapplication,sun_damage,prevention
Chemical vs physical sunscreen,sun_damage,product_recommendation
Zinc oxide sunscreen,sun_damage,product_recommendation
Sunscreen for dark skin,sun_damage,product_recommendation
Sunscreen white cast,sun_damage,product_recommendation
After sun care routine,sun_damage,treatment
Sun allergy rash,sun_damage,allergic_reaction
Tanning bed damage,sun_damage,general
Blue light protection,sun_damage,prevention
SPF in makeup enough,sun_damage,prevention
Mineral sunscreen for acne,sun_damage,product_recommendation
Blackheads in pores,pores,clogged_pores
Pores on cheeks large,pores,enlarged_pores
Niacinamide for pore size,pores,treatment
Retinol minimizing pores,pores,treatment
BHA for clogged pores,pores,treatment
Pore strips good or bad,pores,treatment
Professional pore extraction,pores,professional_care
Genetics and pore size,pores,general
Type 1 rosacea,rosacea,types
Type 2 rosacea treatment,rosacea,types
Ocular rosacea symptoms,rosacea,types
Alcohol trigger for rosacea,rosacea,triggers
Spicy food and rosacea,rosacea,triggers
Azelaic acid for rosacea,rosacea,treatment
Metronidazole cream,rosacea,treatment
Green concealer for redness,rosacea,makeup
Rosacea skin barrier,rosacea,general
Milia under eyes,eye_concerns,milia
Fine lines under eyes,eye_concerns,wrinkles
Sunken eyes,eye_concerns,volume_loss
Eye cream necessary,eye_concerns,product_recommendation
Caffeine eye cream,eye_concerns,ingredients
Retinol around eyes,eye_concerns,treatment
Eye patches for puffiness,eye_concerns,treatment
Tear trough filler,eye_concerns,professional_care
Allergies causing dark circles,eye_concerns,dark_circles
Lip scrub benefits,lip_care,exfoliation
Peeling lips constantly,lip_care,chapped_lips
Lip plumper recommendations,lip_care,product_recommendation
Cold sore vs pimple on lip,lip_care,medical
Lip lines above mouth,lip_care,aging
Best lip treatment overnight,lip_care,product_recommendation
Lanolin for lips,lip_care,ingredients
Peptides in skincare,ingredients,anti_aging
Ceramides for barrier,ingredients,barrier_repair
Squalane oil benefits,ingredients,moisturizing
Azelaic acid uses,ingredients,multi_purpose
Lactic acid exfoliation,ingredients,exfoliant
Mandelic acid gentle exfoliant,ingredients,exfoliant
PHA for sensitive skin,ingredients,exfoliant
Snail mucin benefits,ingredients,hydrating
Propolis in skincare,ingredients,soothing
Centella calming ingredient,ingredients,soothing
Licorice root extract,ingredients,brightening
Argan oil for face,ingredients,oils
Rosehip oil benefits,ingredients,oils
Jojoba oil for skin,ingredients,oils
Vitamin E for scars,ingredients,healing
Ferulic acid with vitamin C,ingredients,antioxidants
Resveratrol antioxidant,ingredients,antioxidants
CoQ10 for skin,ingredients,antioxidants
Urea for dry skin,ingredients,moisturizing
Panthenol benefits,ingredients,soothing
Allantoin soothing,ingredients,soothing
Copper peptides,ingredients,anti_aging
Argireline peptide,ingredients,anti_aging
Matrixyl peptide,ingredients,anti_aging
Adenosine anti-aging,ingredients,anti_aging
How many products is too many,routine,general
Wait time between products,routine,application
Skincare routine for beginners,routine,beginner
Advanced skincare routine,routine,advanced
10-step Korean routine,routine,korean
Simplified 3-step routine,routine,minimalist
AM vs PM routine differences,routine,timing
Exfoliation frequency,routine,frequency
Face masks how often,routine,frequency
Retinol how many times a week,routine,frequency
Cleanser in the morning necessary,routine,cleansing
Oil cleansing method,routine,cleansing
Micellar water as cleanser,routine,cleansing
Face wash vs cleanser,routine,cleansing
Essence in skincare routine,routine,steps
Ampoule vs serum,routine,steps
Face mist benefits,routine,steps
Sleeping mask overnight,routine,evening
Sunscreen last step,routine,sunscreen
Makeup over sunscreen,routine,sunscreen
Best Korean skincare brands,product_recommendation,korean
Japanese skincare products,product_recommendation,japanese
French pharmacy skincare,product_recommendation,french
The Ordinary beginner products,product_recommendation,brand
CeraVe product recommendations,product_recommendation,brand
Drunk Elephant worth it,product_recommendation,brand
Paula's Choice BHA,product_recommendation,exfoliant
Skinceuticals CE Ferulic dupe,product_recommendation,dupe
Cheap retinol alternatives,product_recommendation,dupe
Best vitamin C serum,product_recommendation,vitamin_c
Hydrating toner recommendations,product_recommendation,toner
Niacinamide serum best,product_recommendation,serum
Hyaluronic acid serum,product_recommendation,serum
Sheet mask recommendations,product_recommendation,masks
Clay mask for oily skin,product_recommendation,masks
Sleeping pack Korea,product_recommendation,masks
Best facial cleanser,product_recommendation,cleanser
Gel cleanser recommendations,product_recommendation,cleanser
Cream cleanser for dry skin,product_recommendation,cleanser
Foaming cleanser oily skin,product_recommendation,cleanser
Retinol uglies phase,side_effects,retinol_irritation
Niacinamide flushing,side_effects,niacinamide
Vitamin C oxidized orange,side_effects,vitamin_c
AHA sun sensitivity,side_effects,photosensitivity
Contact dermatitis from product,side_effects,allergic_reaction
Closed comedones from product,side_effects,breakout
Milia from heavy cream,side_effects,milia
Sensitivity from fragrance,side_effects,irritation
Dairy and acne connection,lifestyle,diet
Sugar causing breakouts,lifestyle,diet
Vitamins for healthy skin,lifestyle,supplements
Omega-3 for skin health,lifestyle,supplements
Probiotics for skin,lifestyle,supplements
Collagen powder benefits,lifestyle,supplements
Biotin for skin,lifestyle,supplements
Alcohol effects on skin,lifestyle,alcohol
Lack of sleep aging skin,lifestyle,sleep
Working out and skin,lifestyle,exercise
Yoga for skin glow,lifestyle,exercise
Meditation for clear skin,lifestyle,stress
Air conditioning drying skin,environmental,humidity
Chlorine damage to skin,environmental,water
City pollution and skin,environmental,pollution
Airplane skin care,environmental,travel
Beach vacation skincare,environmental,travel
Mountain climate skin effects,environmental,climate
Desert dry climate skincare,environmental,climate
Skin tag removal,medical_concern,skin_tags
Cherry angioma,medical_concern,general
Seborrheic keratosis,medical_concern,growths
Melasma won't fade,medical_concern,pigmentation
Persistent rash diagnosis,medical_concern,rash
Hives all over body,medical_concern,allergic_reaction
Shingles on skin,medical_concern,viral
Ringworm treatment,medical_concern,fungal
Athlete's foot,medical_concern,fungal
Impetigo symptoms,medical_concern,bacterial
Cellulitis red streaks,medical_concern,bacterial
Boils on skin,medical_concern,bacterial
Abscess treatment,medical_concern,bacterial
Scabies symptoms,medical_concern,parasitic
Bed bug bites,medical_concern,bites
Tick bite rash,medical_concern,bites
Teenage skincare routine,age_specific,teen
Tween acne starting,age_specific,preteen
Skincare in your 20s,age_specific,20s
30s anti-aging prevention,age_specific,30s
40s skincare concerns,age_specific,40s
50+ mature skin routine,age_specific,mature
Elderly thin skin care,age_specific,elderly
Newborn baby skincare,age_specific,baby
Men's anti-aging routine,age_specific,men
Shaving irritation men,age_specific,men
Beard care and skin,age_specific,men
Birth control and acne,hormonal,contraception
PCOS and skin problems,hormonal,pcos
Menopause dry skin,hormonal,menopause
Menopause hot flashes skin,hormonal,menopause
Postpartum acne,hormonal,pregnancy
Pregnancy glow myth,hormonal,pregnancy
Thyroid and skin changes,hormonal,thyroid
PMS breakouts treatment,hormonal,menstrual
Ovulation and skin,hormonal,menstrual
Turmeric mask for skin,home_remedies,masks
Apple cider vinegar toner,home_remedies,toner
Baking soda exfoliant,home_remedies,exfoliation
Lemon juice for dark spots,home_remedies,brightening
Cucumber for puffy eyes,home_remedies,eye_care
Milk for sunburn,home_remedies,sunburn
Egg white mask pores,home_remedies,masks
Rice water for skin,home_remedies,toner
Coffee scrub benefits,home_remedies,exfoliation
Avocado face mask,home_remedies,masks
Yogurt for skin,home_remedies,masks
Rosewater toner DIY,home_remedies,toner
Primer before or after sunscreen,makeup,application
Makeup remover recommendations,makeup,removal
Double cleanse with oil,makeup,removal
Waterproof makeup removal,makeup,removal
BB cream vs CC cream,makeup,products
Tinted moisturizer SPF,makeup,products
Makeup for mature skin,makeup,aging
Non-comedogenic makeup,makeup,acne
Makeup causing closed comedones,makeup,acne
Silicone primers and skin,makeup,ingredients
HydraFacial benefits,professional_care,facials
Oxygen facial worth it,professional_care,facials
LED light therapy,professional_care,treatments
Radiofrequency for tightening,professional_care,treatments
Ultherapy skin tightening,professional_care,treatments
IPL for pigmentation,professional_care,treatments
Fraxel laser,professional_care,treatments
PRP facial vampire facial,professional_care,treatments
TCA peel results,professional_care,peels
Glycolic acid peel,professional_care,peels
VI Peel reviews,professional_care,peels
Dermarolling at home,professional_care,treatments
Gua sha facial benefits,professional_care,massage
Facial massage techniques,professional_care,massage
Lymphatic drainage facial,professional_care,massage
Strawberry legs treatment,body_skin,kp
Chicken skin on arms,body_skin,kp
KP Bump Eraser,body_skin,kp
Body acne on chest,body_skin,bacne
Butt acne treatment,body_skin,bacne
Razor burn prevention,body_skin,shaving
Exfoliating gloves,body_skin,exfoliation
Dry brushing benefits,body_skin,exfoliation
Body butter recommendations,body_skin,product_recommendation
Foot cream for cracked heels,body_skin,feet
Calluses on feet,body_skin,feet
Dark inner thighs,body_skin,hyperpigmentation
Boob acne,body_skin,bacne
Underarm odor and skin,body_skin,general
Dark armpits lightening,body_skin,hyperpigmentation
Body skin texture uneven,body_skin,texture
Expensive skincare dupes,budget,dupes
Luxury vs drugstore comparison,budget,comparison
Best affordable retinol,budget,retinol
Budget vitamin C serum,budget,vitamin_c
Target skincare gems,budget,drugstore
Walmart skincare finds,budget,drugstore
Amazon skincare deals,budget,online
Costco Kirkland skincare,budget,wholesale
Skin worse after dermatologist,troubleshooting,worsening
Product pilling on face,troubleshooting,application
Skincare not absorbing,troubleshooting,application
Too many actives damaged skin,troubleshooting,over_treatment
Damaged moisture barrier,troubleshooting,barrier_damage
How to tell if purging,troubleshooting,purging
Allergic reaction vs irritation,troubleshooting,reaction
When to stop using a product,troubleshooting,discontinue
Rough bumpy skin face,texture,rough_texture
